<!DOCTYPE html>
<html itemscope="" itemtype="//schema.org/Blog" lang="fr">
 <head>
  <script>
   if (window.parent !== window) {
      if (typeof btoa !== "function") {
        window.btoa = function (input) {
          var str = String(input);
          for (var block, charCode, idx = 0, map = chars, output = ''; str.charAt(idx | 0) || (map = '=', idx % 1); output += map.charAt(63 & block >> 8 - idx % 1 * 8)) {
            charCode = str.charCodeAt(idx += 3/4)
            block = block << 8 | charCode
          }
          return output
        }
      }
      var re = /^(?:https?:)?(?:\/\/)?([^\/\?]+)/i
      var res = re.exec(document.referrer)
      var domain = res[1]
      var forbidden = ["aGVsbG8ubGFuZA==","Y3Vpc2luZS5sYW5k","cmVjZXR0ZS5sYW5k","cmVjZXR0ZXMubGFuZA==",]
      if (forbidden.indexOf(btoa(domain)) > -1) {
        document.location = document.location.origin + "/system/noframed"
      }
    }
  </script>
  <link href="//assets.over-blog-kiwi.com/b/blog/bundles/overblogblogblog/css/ob-style.css?v2.23.0.0" rel="stylesheet"/>
  <link href="//assets.over-blog-kiwi.com/b/blog/build/soundplayer.2940b52.css" rel="stylesheet"/>
  <!-- Basic theme id 81 [Kiwi] - last modified : 2018-04-12T15:35:23+02:00 -->
  <!-- test comment -->
  <!-- shortcut:[Meta] -->
  <!-- title -->
  <!-- Title -->
  <title>
   Over-Pair.com - François Montmirel blog poker depuis 2006
  </title>
  <!-- metas description, keyword, robots -->
  <!-- Metas -->
  <meta content="text/html; charset=utf-8" http-equiv="content-type"/>
  <meta charset="utf-8"/>
  <meta content="width=device-width" name="viewport"/>
  <meta content="Francois M." name="author"/>
  <meta content="Over-Pair.com" property="og:site_name"/>
  <meta content="Over-Pair.com" property="og:title"/>
  <meta content="Over-Pair.com" name="twitter:title"/>
  <meta content="Fran&amp;ccedil;ois Montmirel blog poker depuis 2006" name="description"/>
  <meta content="Fran&amp;ccedil;ois Montmirel blog poker depuis 2006" property="og:description"/>
  <meta content="Fran&amp;ccedil;ois Montmirel blog poker depuis 2006" name="twitter:description"/>
  <meta content="fr_FR" property="og:locale"/>
  <meta content="http://fdata.over-blog.com/0/23/09/04/avatar-blog-15169151-tmpphpmrRGYT.jpeg" property="og:image"/>
  <meta content="http://fdata.over-blog.com/0/23/09/04/avatar-blog-15169151-tmpphpmrRGYT.jpeg" name="twitter:image:src"/>
  <meta content="blog" property="og:type"/>
  <meta content="summary" name="twitter:card"/>
  <meta content="@overblog" name="twitter:site"/>
  <meta content="@" name="twitter:creator"/>
  <meta content="284865384904712" property="fb:app_id"/>
  <!-- Robots -->
  <meta content="index,follow" name="robots"/>
  <!-- RSS -->
  <link href="/rss" rel="alternate" title="RSS" type="application/rss+xml"/>
  <!-- Analytics -->
  <meta content="5wGr6NMQly8DnemYJGr81d9TZmqWHfRt6QkRMnqSwbQ" name="google-site-verification"/>
  <!-- shortcut:[Includes] -->
  <!-- favicon -->
  <!-- Metas -->
  <link href="http://fdata.over-blog.com/0/23/09/04/avatar-blog-15169151-tmpphpmrRGYT.jpeg" rel="icon" type="image/png"/>
  <!-- Custom vars -->
  <!-- General/Header -->
  <meta default="Abstract-green" group="general" items="Abstract-black, Abstract-blue, Abstract-blue-bubble, Abstract-blue-green, Abstract-blue-tech, Abstract-brown-blue, Abstract-colors, Abstract-cream, Abstract-gold, Abstract-green, Abstract-green2, Abstract-green3, Abstract-orange-pink, Abstract-pastel, Abstract-red, Abstract-round, Abstract-yellow, Amp-buttons, Animals-drawing, Apartment, Astrology, Baloon, Bass-guitar, Beach, Beach2, Beach3, Bike, Bikes, Binary-numbers, Biplan-plane, Black-car, Black-guitar, Black-leather, Blackboard, Blured-light, Boat, Book, Book-shelf, Bread, Briks, Brooklyn-bridge, Brown-texture, Cello, Chinese, Chocolate, Cinema, City-by-night, City-drawing, Concert, Cooking, Cooking2, Cork-stoppers, Dashboard, Desert, Desert-road, DJ, Dots, Drawing, Drawing-blue-flowers, Dressing, Eiffel-tower, Elephant, Eye, Fabric-green, Felin, Field, Finance, Fire, Fishes, Footing, Forest-autumn, Fruits, Gardening, Gold-paper, Gold-rings, Gold-wave, Golf, Graphiti, Graphiti2, Grass-and-tree, Guitars, Heart, Hearts, Hong-kong-by-night, Horses, Horses2, Iceberg, Lab, Ladybugs, Layout, Layout-and-tools, Lily-patern, London-by-night, Makeup, Makeup2, Microprocessor, Monument-valley, Monuments, Moon-rise, Moto, Moto2, Moto3, Mountain-snow, Muscles, Music-studio, New-york-by-night, NYC-direction, Old-books, Old-car, Old-stamps, Orange-car, Orange-stars, Oxeye-daisy, Paradise-island, Paris-sepia, Patchwork, Patchwork2, Penguins, Pets, Pets2, Piano, Pink-flower, Plane-and-clunds, Red-car, Red-old-car, Rose, Sailboat, Sea-sky, Seattle, Sewing, Sewing2, Shopping, Ski, Skull, Snowflake, Starting-block, Stream-car, Sunset, Surf, Surfer, Taxis-NYC, The-world, Tools, Vegetables, Watch-mechanism, White-flowers, White-rose, Writing, Yellow-biplan-plane, Zen, Zodiac" name="imagelist:background_header:label.Image"/>
  <!-- Text -->
  <meta default="" group="Text" items="Arimo, BookSerif, DroidSerif, ElegantSerif, Future, Garamond, Gothic, Handwright, Josefin, Lora, MerriweatherSansSerif, RalewaySansSerif, RobotoTrendySansSerif" name="fontlist:font:label.Fonts"/>
  <!-- Black, Blue, Green, Grey, Iceberg, Ivory, Orange, Pink, Purple, Red -->
  <meta default="White" group="Text" items="Leaves, Birds, Dust, Fabric, Fiber, Greyz, Ivory, Light-grey, Paper, Paper2, Squairy, White" name="patternlist:background_content:label.BackgroundColorOrPatern"/>
  <!-- Menu Bar -->
  <!-- Appareance -->
  <!-- Widgets -->
  <!--[if lt IE 9]>
            <script src="//html5shim.googlecode.com/svn/trunk/html5.js"></script>
        <![endif]-->
  <!-- Template resources -->
  <link href="//fonts.googleapis.com/css?family=Droid+Serif:400,700,400italic,700italic|Oswald:400,700" rel="stylesheet" type="text/css"/>
  <!-- Fancybox -->
  <link href="//assets.over-blog.com/t/catalog/jquery/fancybox/2.5/source/jquery.fancybox.css?v=2.1.5" media="screen" rel="stylesheet" type="text/css"/>
  <!-- Nivo-slider -->
  <link href="//assets.over-blog.com/t/catalog/jquery/nivo-slider/3.2/nivo-slider.css" rel="stylesheet" type="text/css"/>
  <link href="//assets.over-blog.com/t/catalog/jquery/nivo-slider/3.2/themes/default/default.css" rel="stylesheet" type="text/css"/>
  <style type="text/css">
   /*----- Reset -----*/
            body,div,dl,dt,dd,ul,ol,li,h1,h2,h3,h4,h5,h6,pre,form,fieldset,input,p,textarea,blockquote,th,td{ margin:0; padding:0;}
            table{ border-collapse:collapse; border-spacing:0;}
            fieldset,img{ border:0;}
            address,caption,cite,code,dfn,var{ font-style:normal; font-weight:normal;}
            caption,th{ text-align:left;}
            h1,h2,h3,h4,h5,h6{ font-size:100%; font-weight:normal;}
            q:before,q:after{ content:'';}
            abbr,acronym{ border:0;}
            pre{ white-space: normal;}

            /* Standard styles */
            .clear{
                clear: both;
            }
            .clearfix:before, .clearfix:after{
                content: "";
                display: table;
            }
            .clearfix:after{
                clear: both;
            }

            /* Theme styles */
            /* Base */
            html{
                font-size: 62.5%;
            }
            body{
                font-family: Georgia, Times, serif;
                word-wrap: break-word;
            }
            h1, h2, h3, h4, h5, h6,
            .blog-title, .widget-title
            {
                font-family: 'Arvo', Helvetica, Arial, sans-serif;
            }
            a{
                text-decoration: none;
            }
            a:hover, a:focus, a:active{
                text-decoration: underline;
            }
            ol ol, ul ul{
                margin-bottom: 0;
            }
            .post ol, .post ul{
                margin-left: 40px;
            }
            .no-margin{
                margin: 0 !important;
            }

            /* Vertical grid */
            body{
                line-height: 20px;
            }
            p, ol, ul{
                margin-bottom: 30px;
            }
            .global{
                margin-bottom: 30px;
                margin-top: 30px;
            }
            .blog-header {
                overflow: hidden;
            }

            .blog-header,
            .menu,
            .slider-wrapper,
            .widget,
            .navigation,
            .ob-pagination,
            .share,
            .ads,
            .post {
                margin-bottom: 30px;
            }

            .post-title {
                font-size: 2.1em;
                line-height: 45px;
                margin: 0;
            }

            
            /* Font size & line-height */
                            body{
                    font-size: 1.6em;
                    line-height: 30px;
                }
                h1{
                    font-size: 2.500em; /* 40px */
                    line-height: 55px;
                    margin: 40px 0 0 0;
                }
                h2, .post-title{
                    font-size: 2.188em; /* 35px */
                    line-height: 55px;
                    margin: 20px 0 0 0;
                }
                h3{
                    font-size: 1.5em; /* 24px */
                    line-height: 35px;
                    margin: 20px 0 0 0;
                }
                h4{
                    font-size: 1.375em; /* 22px */
                    line-height: 35px;
                    margin: 20px 0 0 0;
                }
                h5{
                    font-size: 1.250em; /* 20px */
                    line-height: 30px;
                    margin: 20px 0 0 0;
                }
                h6{
                    font-size: 1.125em; /* 18px */
                    line-height: 30px;
                    margin: 20px 0 0 0;
                }
                .footer h3{
                    font-size: 1.125em; /* 18px */
                }
                .sidebar .widget-title{
                    font-size: 1.5em; /* 24px */
                    line-height: 43px;
                    margin: 20px 0 0 0;
                }
            
            .blog-header .blog-title{
                font-size: 45px;
                line-height: 60px;
                margin: 0;
            }
            
            /* Global */
            body{
                background-color: #d0d0d0;
            }
            .global{
                background-color: #fff;
                box-shadow: 0 2px 6px rgba(100, 100, 100, .3);
                margin-left: auto;
                margin-right: auto;
                width: 980px;
            }
                        .blog-header p{
                font-size: 22px;
                line-height: 25px;
                margin-bottom: 0;
            }
            .menu{
                border-bottom: 1px solid #aaa;
                border-top: 1px solid #aaa;
                height: 38px; /* + borders = 40px */
                margin-left: 20px;
                margin-right: 20px;
                margin-top: 0;
                overflow: hidden;
            }
            .menu ul{
                list-style: none;
                margin: 0;
            }
            .menu li{
                float: left;
            }
            .menu li+li{
                margin-left: 20px;
            }
            .menu a{
                display: table-cell;
                height: 38px; /* + borders = 40px */
                vertical-align: middle;
            }

            .slider-wrapper{
                height: 320px;
                margin-left: 20px;
                margin-right: 20px;
                overflow: hidden;
                width: 940px;
            }
            .slideshow{
                position: relative;
            }

            .content-global{
                margin: 0 20px;
            }

            .ob-text > *:first-child,
            .widget > *:first-child{
                margin-top: 0;
            }

            .ob-text > *:last-child,
            .widget > *:last-child{
                margin-bottom: 0;
            }

            /* left content : posts */
            .left-content{
                float: left;
                margin: 0 20px 0 0;
                width: 620px;
            }
            .special-title{
                margin: 0 0 20px 0;
            }
            .post .post-title{
                margin-top: 0;
            }
                            .post-sidebox,
                .post-content{
                    float: left;
                }
                .post-sidebox{
                    position: relative;
                    margin-right: 20px;
                    min-height: 30px;
                    width: 100px;
                }
                .post-date{
                    background-color: rgb(10, 10, 10); /* IE8 */
                    background-color: rgba(0, 0, 0, .85);
                    color: #EFEFEF;
                    padding: 5px 0;
                    position: absolute;
                    text-align: center;
                    width: 100px;
                }
                                    .post-content{
                        width: 480px;
                    }
                            
            .snippet{
                margin-bottom: 10px;
            }
            .readmore{
                margin-bottom: 0;
            }
            .readmore a{
                font-size: 0.7em;
                letter-spacing: .2em;
                text-transform: uppercase;
            }

            /* Single post */
            .ob-repost > p{
                margin: 0;
            }
            .meta{
                font-size: 0.9em;
                font-style: italic;
            }
            .share h3{
                margin: 0px 0 10px 0;
            }
            .facebook-share,
            .linkedin-share,
            .ob-share{
                margin-right: 10px;
            }
            a.ob-repost-btn{
                vertical-align: top;
            }
            .facebook-share .fb_iframe_widget > span {
                vertical-align: top !important;
            }

            /* pagination */
            .ob-pagination{
                text-align: center;
            }
            .navigation a,
            .ob-pagination .ob-page{
                border: 1px solid #aaa;
                display: inline-block;
                text-align: center;
            }
            .navigation a{
                padding: 12px 15px;
            }
            .ob-pagination .ob-page{
                margin-bottom: 10px;
                padding: 0 9px;
            }

            /* Comments */
            .ob-commentsList{
                font-family: inherit;
            }
            .ob-commentsList,
            .ob-commentsList .ob-message .ob-text{
                font-size: inherit;
            }
            .ob-commentsList .ob-message .ob-text{
                line-height: inherit;
            }
            .item-comments h3,
            .ob-commentsList .ob-info{
                margin-bottom: 10px;
            }

            /* right content : sidebar */
            .right-content{
                float: right;
                width: 300px;
            }
            .sidebar .widget-title{
                border-bottom: 1px solid #aaa;
                border-top: 1px solid #aaa;
                margin-bottom: 20px;
                margin-top: 0;
            }
            .sidebar ul{
                list-style: none;
            }
            .archives ul ul{
                margin-left: 20px;
            }
            /* modules */
            .about .avatar{
                float: left;
                max-height: 100px;
                margin: 0 10px 10px 0;
            }

            /* Hub */
            .right-content .post{
                margin-bottom: 20px;
            }
            .widget .ob-section{
                margin: 0;
            }
            .widget .ob-section-images{
                margin-bottom: 10px;
            }
            .social-hub .cover{
                display: block;
                margin: 0 auto;
            }

            /* follow */
            .follow ul{
                list-style: none;
            }
            .follow li{
                display: inline-block;
                margin: 5px 10px 5px 0;
            }
            .follow a{
                background: url('//assets.over-blog.com/t/catalog/images/follow/follow-24.png') no-repeat top left;
                display: block;
                height: 24px;
                text-indent: -99999%;
                width: 24px;
            }
            .follow .twitter a{
                background-position: 0 0;
            }
            .follow .facebook a{
                background-position: 0 -48px;
            }
            .follow .googleplus a{
                background-position: 0 -96px;
            }
            .follow .pinterest a{
                background-position: 0 -144px;
            }
            .follow .foursquare a{
                background-position: 0 -192px;
            }
            .follow .instagram a{
                background-position: 0 -240px;
            }
            .follow .flickr a{
                background-position: 0 -288px;
            }
            .follow .youtube a{
                background-position: 0 -336px;
            }
            .follow .linkedin a{
                background-position: 0 -384px;
            }
            .follow .bloglovin a{
                background-position: 0 -432px;
            }
            .follow .rss a{
                background-position: 0 -480px;
            }

            /* subscribe */
            .subscribe p{
                margin-bottom: 10px;
            }
            .subscribe .ob-label{
                display: none;
            }
            .subscribe .ob-form-field,
            .subscribe .ob-input-submit{
                display: inline-block;
                margin: 0;
            }
            .subscribe .ob-input-email,
            .search input[type="text"]{
                width: 200px;
            }

            /* last posts */
            .last-posts li{
                display: block;
                overflow: hidden;
                float: left;
                height: 100px;
                position: relative;
                width: 100px;
            }
            .last-posts .caption{
                background: #111;
                background: rgba(17,17,17,0.95);
                display: block;
                height: 90px;
                overflow: hidden;
                padding: 5px;
                position: absolute;
                top: 0;
                -webkit-transition: all 500ms ease;
                   -moz-transition: all 500ms ease;
                     -o-transition: all 500ms ease;
                        transition: all 500ms ease;
                width: 90px;
            }

            .last-posts .cover,
            .last-posts .cover img {
                display: block;
            }

            .last-posts .caption {
                color: #FFF;
                display: inline-block;
                -webkit-hyphens: auto;
                   -moz-hyphens: auto;
                    -ms-hyphens: auto;
                     -o-hyphens: auto;
                        hyphens: auto;
                line-height: 20px;
                overflow: hidden;
                width: 100%;
                word-wrap: break-word;
            }

            .last-posts li .cover > .caption,
            .last-posts li:hover .cover img + .caption {
                margin-left: 0;
                -webkit-transition: all 300ms ease-in;
                   -moz-transition: all 300ms ease-in;
                     -o-transition: all 300ms ease-in;
                        transition: all 300ms ease-in;
                filter:alpha(opacity=100);
                opacity: 1;
            }

            .last-posts .cover img + .caption {
                margin-left: -100px;
                -webkit-transition: all 300ms ease-out;
                   -moz-transition: all 300ms ease-out;
                     -o-transition: all 300ms ease-out;
                        transition: all 300ms ease-out;
                filter:alpha(opacity=0);
                opacity: 0;
            }

            /* sections */
            .ob-media{
                max-width: 100%;
            }
            .ob-section-images{
                width: 100%;
            }
            .ob-section-images img{
                max-width: 100%;
                vertical-align: top;
            }
            .ob-row-1-col,
            .ob-row-2-col,
            .ob-row-3-col{
                margin-bottom: 20px;
            }
            .left-content .ob-row-1-col a{
                margin: 0 10px;
            }
            .left-content .ob-row-2-col a+a{
                margin-left: 20px;
            }
            .left-content .ob-row-3-col a+a{
                margin-left: 10px;
            }
            .left-content .ob-row-1-col img{
                max-width: 600px;
            }

            /* forms */
            #global input[type="text"],
            #global input[type="email"],
            #global input[type="submit"],
            #global textarea{
                border: 1px solid #525252;
                padding: 4px 2px;
            }
            #global input[type="submit"]{
                background-clip: padding-box;
                background-color: #e1e1e1;
                background-image: -webkit-linear-gradient(#f3f3f3, #e9e9e9);
                background-image: -moz-linear-gradient(#f3f3f3, #e9e9e9);
                background-image: -o-linear-gradient(#f3f3f3, #e9e9e9);
                border: 1px solid #d0d0d0;
                border-radius: 0.2em;
                -webkit-box-shadow: inset 0px 0px 2px #fff;
                -moz-box-shadow: inset 0px 0px 2px #fff;
                -o-box-shadow: inset 0px 0px 2px #fff;
                box-shadow: inset 0px 0px 2px #fff;
                cursor: pointer;
                overflow: visible;
                padding: 4px 5px;
                text-align: center;
                text-shadow: 1px 1px 1px #fff;
                white-space: nowrap;
            }
            #global input[type="submit"]:hover,
            #global input[type="submit"]:focus,
            #global input[type="submit"]:active{
                border: 1px solid #b0b0b0;
                background-color: #ededed;
                background-image: -webkit-linear-gradient(#e1e1e1, #ededed);
                background-image: -moz-linear-gradient(#e1e1e1, #ededed);
                background-image: -o-linear-gradient(#e1e1e1, #ededed);
            }
            #global input[type="submit"]:active {
                border: 1px solid #666;
                -webkit-box-shadow: inset 0px 0px 3px #999;
                -moz-box-shadow: inset 0px 0px 3px #999;
                -o-box-shadow: inset 0px 0px 3px #999;
                box-shadow: inset 0px 0px 3px #999;
            }

            
                            /* Défault Black */
                body{
                    color: #000000;
                }
                h1, h2, h3, h4, h5, h6,
                h1 a, h2 a, h3 a, h4 a, h5 a, h6 a,
                .ob-commentsList .ob-website,
                .blog-title, .widget-title{
                    color: #000000;
                }
                a{
                    color: #0084b4;
                }
                a:hover, a:focus, a:active{
                    color: #0084b4;
                }

                .ob-commentsList .ob-message .ob-text{
                    background-color: #ddd;
                    border-color: #000000;
                }

            
            
                            body{
                    font-family: 'Droid Serif', serif;
                }
                h1, h2, h3, h4, h5, h6, .blog-title, .widget-title{
                    font-family: 'Oswald', sans-serif;
                }
            
                            body{
                                            background-image : url(//assets.over-blog.com/t/catalog/images/background/body/Snowman.png);
                                    }
            
                            .global, .ads-728x90{
                                            background-color: #ffffff;
                                    }
            
                                                .blog-header{
                        background: url(https://img.over-blog-kiwi.com/980x320-ct/1/52/82/13/20161121/ob_ffcdfd_imagefront.jpg) no-repeat center top;
                    }
                            
                            .blog-header{
                    height: 320px;
                }
                .title{
                    background: white;
                    display: inline-block;
                    max-height: 240px;
                    max-width: 860px;
                    overflow: hidden;
                    padding: 10px 20px;
                    position: relative;
                }
                                    .title{
                        max-width: 900px;
                    }
                                .title a{
                    display: block;
                    overflow: hidden;
                    text-overflow: ellipsis;
                    white-space: nowrap;
                }

                                    .title{
                        left: 20px;
                        opacity: 0.8;
                        filter: alpha(opacity=80);
                        top: 20px;
                    }
                
                            
            
            
            .ob-Outbrain_link,
            .ob-RelatedPost-link {
                line-height: 1.4;
            }

            /* Newsletter Form */
            .ob-Newsletter {
                margin-top: 20px;
            }

                .ob-Newsletter-toggle,
                .ob-Newsletter-submit {
                    border-radius: 0;
                    color: #fff;
                                        background: #0084b4;
                    border-color: #000000;
                                    }
  </style>
  <script src="//assets.over-blog-kiwi.com/b/blog/bundles/overblogblogblog/js/ads.js?v2.23.0.0">
  </script>
  <script>
   (function(i,s,o,g,r,a,m){i['GoogleAnalyticsObject']=r;i[r]=i[r]||function(){
  (i[r].q=i[r].q||[]).push(arguments)},i[r].l=1*new Date();a=s.createElement(o),
  m=s.getElementsByTagName(o)[0];a.async=1;a.src=g;m.parentNode.insertBefore(a,m)
  })(window,document,'script','//www.google-analytics.com/analytics.js','ga');

  ga('create', 'UA-5354236-47', {
    cookieDomain: 'www.over-pair.com',
    cookieExpires: 31536000,
    name: 'ob',
    allowLinker: true
  });

  ga('ob.require', 'displayfeatures');
  ga('ob.require', 'linkid', 'linkid.js');
  ga('ob.set', 'anonymizeIp', true);
  ga('ob.set', 'dimension1', '__ads_loaded__' in window ? '1' : '0');
  ga('ob.set', 'dimension2', 'fr');
  ga('ob.set', 'dimension3', 'BS');
  ga('ob.set', 'dimension4', 'gaming-video-gaming');
  ga('ob.set', 'dimension5', '0');
  ga('ob.set', 'dimension6', '0');
  ga('ob.set', 'dimension7', '1');
  ga('ob.set', 'dimension10', '1528213');
  ga('ob.set', 'dimension11', '1');
  ga('ob.set', 'dimension12', '2');
  ga('ob.set', 'dimension13', '0');

  ga('ob.send', 'pageview');
  </script>
  <script>
   var obconnected = 0
  var obconnectedblog = 0
  var obtimestamp = 0

  function isConnected(connected, connected_owner, timestamp) {
    obconnected     =  connected
    obconnectedblog =  connected_owner
    obtimestamp     =  timestamp

    if (obconnected) {
      document.querySelector('html').className += ' ob-connected'
    }

    if (obconnectedblog) {
      document.querySelector('html').className += ' ob-connected-blog'
    }
  }
  </script>
  <script src="//connect.over-blog.com/ping/1528213/isConnected">
  </script>
  <script src="//assets.over-blog-kiwi.com/b/blog/bundles/overblogblogblog/js/h.js?v2.23.0.0">
  </script>
  <script src="//assets.over-blog-kiwi.com/b/blog/bundles/overblogblogblog/js/repost.js?v2.23.0.0">
  </script>
  <script src="//assets.over-blog-kiwi.com/b/blog/bundles/overblogblogblog/js/slideshow.js?v2.23.0.0">
  </script>
  <script src="//assets.over-blog-kiwi.com/b/blog/build/soundplayer.2940b52.js">
  </script>
  <script src="//assets.over-blog-kiwi.com/blog/js/index.js?v2.23.0.0">
  </script>
  <script>
   var _eStat_Whap_loaded=0;
  </script>
  <script src="//w.estat.com/js/whap.js">
  </script>
  <script>
   if(_eStat_Whap_loaded) {
      eStatWhap.serial("800000207013");
      eStatWhap.send();
    }
  </script>
  <script async="" src="https://cdn.tradelab.fr/tag/208269514b.js">
  </script>
 </head>
 <body>
  <div class="ob-ShareBar ob-ShareBar--dark js-ob-ShareBar">
   <div class="ob-ShareBar-container ob-ShareBar-container--left">
    <a class="ob-ShareBar-branding" href="https://www.over-blog.com">
     <img alt="Overblog" class="ob-ShareBar-brandingImg" src="//assets.over-blog-kiwi.com/b/blog/bundles/overblogblogblog/images/shareicon-branding-ob--dark.png?v2.23.0.0"/>
    </a>
    <a class="ob-ShareBar-share ob-ShareBar-share--facebook" data-href="https://www.facebook.com/sharer/sharer.php?u={referer}" href="#" title="Facebook">
    </a>
    <a class="ob-ShareBar-share ob-ShareBar-share--twitter" data-href="https://twitter.com/intent/tweet?url={referer}&amp;text={title}" href="#" title="Twitter">
    </a>
    <a class="ob-ShareBar-share ob-ShareBar-share--pinterest js-ob-ShareBar-share--pinterest" data-href="#" href="#" title="Pinterest">
    </a>
    <a class="ob-ShareBar-share ob-ShareBar-share--gplus" data-href="https://plus.google.com/share?url={referer}" href="#" title="Google+">
    </a>
    <a class="ob-ShareBar-follow js-ob-ShareBar-follow" href="https://admin.over-blog.com/_follow/1528213" rel="nofollow" target="_blank">
     <strong>
      Suivre
     </strong>
     ce blog
    </a>
   </div>
   <div class="ob-ShareBar-container ob-ShareBar-container--right">
    <form accept-charset="utf-8" action="/search" class="ob-ShareBar-search" method="post">
     <input class="ob-ShareBar-input" name="q" placeholder="Rechercher" type="text" value=""/>
     <button class="ob-ShareBar-submit">
     </button>
    </form>
    <a class="ob-ShareBar-admin ob-ShareBar--connected" href="https://admin.over-blog.com/">
     <span>
      Administration
     </span>
    </a>
    <a class="ob-ShareBar-login ob-ShareBar--notconnected" href="https://connect.over-blog.com/fr/login">
     <span>
      Connexion
     </span>
    </a>
    <a class="ob-ShareBar-create ob-ShareBar--notconnected" href="https://connect.over-blog.com/fr/signup">
     <span>
      Créer mon blog
     </span>
    </a>
    <span class="ob-ShareBar-toggle ob-ShareBar-toggle--hide js-ob-ShareBar-toggle">
    </span>
   </div>
  </div>
  <div class="ob-ShareBar ob-ShareBar--minified js-ob-ShareBar--minified">
   <div class="ob-ShareBar-container">
    <span class="ob-ShareBar-toggle ob-ShareBar-toggle--show js-ob-ShareBar-toggle">
    </span>
   </div>
  </div>
  <script src="//assets.over-blog-kiwi.com/b/blog/bundles/overblogblogblog/js/sharebar.js?v2.23.0.0">
  </script>
  <script>
   var postTitle = "Over-Pair.com"
    socialShare(document.querySelector('.ob-ShareBar-share--facebook'), postTitle)
    socialShare(document.querySelector('.ob-ShareBar-share--twitter'), postTitle)
    socialShare(document.querySelector('.ob-ShareBar-share--gplus'), postTitle)
  </script>
  <div id="fb-root">
  </div>
  <div class="global clearfix">
   <header class="blog-header" role="banner">
    <div class="title">
     <h1 class="blog-title">
      <a href="http://www.over-pair.com" title="François Montmirel blog poker depuis 2006">
       Over-Pair.com
      </a>
     </h1>
     <p class="description">
      François Montmirel blog poker depuis 2006
     </p>
    </div>
   </header>
   <nav class="menu" role="navigation">
    <ul class="clearfix">
     <li class="selected">
      <a class="selected" href="http://www.over-pair.com">
       Accueil
      </a>
     </li>
     <li class="selected">
      <a class="selected" href="http://www.fantaisium.fr/">
       Fantaisium.fr
      </a>
     </li>
     <li>
      <a href="http://www.over-pair.com/article-7218384.html">
       Les meilleurs livres de poker
      </a>
     </li>
     <li>
      <a href="http://www.over-pair.com/tag/strategie/">
       Stratégie
      </a>
     </li>
     <li>
      <a href="http://www.over-pair.com/calculez-vos-probabilites.html">
       Calculs
      </a>
     </li>
     <li>
      <a href="/contact" title="Contact">
       Contact
      </a>
     </li>
    </ul>
   </nav>
   <div class="slider-wrapper theme-default">
    <div class="ribbon">
    </div>
    <div class="slideshow" id="slideshow">
     <a href="http://www.over-pair.com/2018/05/un-francais-gagne-l-esp-monte-carlo.html">
      <img alt="Un Français gagne l'EPT Monte-Carlo" height="320" src="https://img.over-blog-kiwi.com/940x320-ct/1/52/82/13/20180511/ob_a24c11_capture-d-e-cran-2018-05-11-a-12.png" title="Un Français gagne l'EPT Monte-Carlo" width="940"/>
     </a>
     <a href="http://www.over-pair.com/2017/11/benjamin-pollack-et-antoine-saout-heros-du-poker-francais.html">
      <img alt="Benjamin Pollack et Antoine Saout au sommet du poker francais" height="320" src="https://img.over-blog-kiwi.com/940x320-ct/1/52/82/13/20171115/ob_240b5c_pollak.jpg" title="Benjamin Pollack et Antoine Saout au sommet du poker francais" width="940"/>
     </a>
     <a href="http://www.over-pair.com/2017/07/wsop-2-francais-en-finale-du-plus-grand-tournoi-de-poker-du-monde.html">
      <img alt="WSOP : 2 FRANCAIS EN FINALE DU PLUS GRAND TOURNOI DE POKER DU MONDE" height="320" src="https://img.over-blog-kiwi.com/940x320-ct/1/52/82/13/20170718/ob_455ba4_s1e44f59c78.jpg" title="WSOP : 2 FRANCAIS EN FINALE DU PLUS GRAND TOURNOI DE POKER DU MONDE" width="940"/>
     </a>
     <a href="http://www.over-pair.com/2017/06/poker-hall-of-fame-votez-pour-pierre-neuville.html">
      <img alt="Poker Hall of Fame : votez pour Pierre Neuville !" height="320" src="https://img.over-blog-kiwi.com/940x320-ct/1/52/82/13/20170620/ob_66143e_pneuville-2.jpg" title="Poker Hall of Fame : votez pour Pierre Neuville !" width="940"/>
     </a>
     <a href="http://www.over-pair.com/2017/06/un-coup-de-poker-poour-aider-nos-amis-magiciens.html">
      <img alt="Un coup de poker pour aider nos amis magiciens" height="320" src="https://img.over-blog-kiwi.com/940x320-ct/1/52/82/13/20170619/ob_b94311_cfi1.png" title="Un coup de poker pour aider nos amis magiciens" width="940"/>
     </a>
     <a href="http://www.over-pair.com/2017/05/world-series-of-poker-2017-shuffle-up-and-deal.html">
      <img alt="World Series Of Poker 2017 : shuffle up and deal" height="320" src="https://img.over-blog-kiwi.com/940x320-ct/1/52/82/13/20170531/ob_0e09fb_moss-ungar-brunson.jpg" title="World Series Of Poker 2017 : shuffle up and deal" width="940"/>
     </a>
     <a href="http://www.over-pair.com/2017/06/de-nouveaux-clubs-de-poker-a-paris-des-janvier-2018.html">
      <img alt="De nouveaux clubs de poker à Paris dès janvier 2018" height="320" src="https://img.over-blog-kiwi.com/940x320-ct/1/52/82/13/20170601/ob_5c4122_240522-web.jpg" title="De nouveaux clubs de poker à Paris dès janvier 2018" width="940"/>
     </a>
     <a href="http://www.over-pair.com/2017/04/poker-sport-ou-pas-sport.html">
      <img alt="Poker : sport ou pas sport ?" height="320" src="http://resize.over-blog.com/940x320-ct.jpg?https://i.ytimg.com/vi/sAI-X6-kHsg/hqdefault.jpg" title="Poker : sport ou pas sport ?" width="940"/>
     </a>
     <a href="http://www.over-pair.com/2017/05/le-poker-de-la-mort.html">
      <img alt="Le poker de la mort !" height="320" src="http://resize.over-blog.com/940x320-ct.jpg?https://images.6play.fr/v1/images/347118/raw?width=1120&amp;height=630&amp;fit=scale&amp;crop=center&amp;hash=5dd25863ef8b1cf930eb2319c5ad5d845dc57acb" title="Le poker de la mort !" width="940"/>
     </a>
     <a href="http://www.over-pair.com/2017/03/une-couverture-entierement-redessinee-les-probabilites-et-d-une-maniere-generale-les-chiffres-constituent-un-sujet-sensible-au-poker">
      <img alt="Essentiel des Probabilités au Poker : la nouvelle version est disponible" height="320" src="https://img.over-blog-kiwi.com/940x320-ct/1/52/82/13/20170301/ob_2b54d2_essentiel-probabilites-poker-c1-lr.jpg" title="Essentiel des Probabilités au Poker : la nouvelle version est disponible" width="940"/>
     </a>
     <a href="http://www.over-pair.com/2017/02/le-club-anglais-contraint-de-fermer.html">
      <img alt="Le Club Anglais contraint de fermer" height="320" src="https://img.over-blog-kiwi.com/940x320-ct/1/52/82/13/20170221/ob_47b6ca_les-tontons-flingueurs.jpg" title="Le Club Anglais contraint de fermer" width="940"/>
     </a>
     <a href="http://www.over-pair.com/2017/02/c-est-fait-l-intelligence-artificielle-bat-l-homme-au-poker-a-deux.html">
      <img alt="C’est fait : l’intelligence artificielle bat l’homme au poker à deux" height="320" src="https://img.over-blog-kiwi.com/940x320-ct/1/52/82/13/20170207/ob_8b89da_libratus2017.jpg" title="C’est fait : l’intelligence artificielle bat l’homme au poker à deux" width="940"/>
     </a>
     <a href="http://www.over-pair.com/2017/01/un-petit-poke-meilleurs-voeux-2017-a-tous.html">
      <img alt='"Un petit poke ?" Meilleurs vœux 2017 à tous !' height="320" src="https://img.over-blog-kiwi.com/940x320-ct/1/52/82/13/20170108/ob_60861f_pokergotlib.jpg" title='"Un petit poke ?" Meilleurs vœux 2017 à tous !' width="940"/>
     </a>
     <a href="http://www.over-pair.com/2016/12/poker-omaha-a-deauville.html">
      <img alt="Poker Omaha à Deauville" height="320" src="https://img.over-blog-kiwi.com/940x320-ct/1/52/82/13/20161214/ob_8f9380_20161210-101810.jpg" title="Poker Omaha à Deauville" width="940"/>
     </a>
     <a href="http://www.over-pair.com/2016/11/autour-de-la-nouvelle-version-de-ce-blog.html">
      <img alt="Autour de la nouvelle version du blog Over-pair.com" height="320" src="https://img.over-blog-kiwi.com/940x320-ct/1/52/82/13/20161121/ob_e07ad2_fm-ladysmile-20150611-jpg.jpg" title="Autour de la nouvelle version du blog Over-pair.com" width="940"/>
     </a>
     <a href="http://www.over-pair.com/2016/10/wsop-circuit-paris.html">
      <img alt="WSOP Circuit - Paris" height="320" src="https://img.over-blog-kiwi.com/940x320-ct/1/52/82/13/20161026/ob_cb003b_wsop-international-circuit-schedule-he.jpg" title="WSOP Circuit - Paris" width="940"/>
     </a>
     <a href="http://www.over-pair.com/2016/10/un-coup-de-pouce-pour-natural-born-player.html">
      <img alt='Un coup de pouce pour "Natural Born Player"' height="320" src="https://img.over-blog-kiwi.com/940x320-ct/1/52/82/13/20161017/ob_34e5a0_naturalbornplayer.png" title='Un coup de pouce pour "Natural Born Player"' width="940"/>
     </a>
     <a href="http://www.over-pair.com/2016/06/une-carte-d-un-demi-million-de-dollars.html">
      <img alt="Une carte d'un demi-million de dollars" height="320" src="http://img.over-blog-kiwi.com/940x320-ct/1/52/82/13/20160615/ob_41db20_27605305161-886656f928-z.jpg" title="Une carte d'un demi-million de dollars" width="940"/>
     </a>
     <a href="http://www.over-pair.com/2016/06/jouer-au-poker-debout-dans-un-cube.html">
      <img alt="Jouer au poker debout dans un cube !" height="320" src="http://img.over-blog-kiwi.com/940x320-ct/1/52/82/13/20160609/ob_20b393_gpl-hu.png" title="Jouer au poker debout dans un cube !" width="940"/>
     </a>
     <a href="http://www.over-pair.com/2016/04/paul-daniels-disparait.html">
      <img alt="Paul Daniels disparaît" height="320" src="https://img.over-blog-kiwi.com/940x320-ct/1/52/82/13/20161121/ob_b5a230_paul-daniels-headshot.jpg" title="Paul Daniels disparaît" width="940"/>
     </a>
     <a href="http://www.over-pair.com/2016/01/une-tres-bonne-annee-et-de-quoi-lire-un-peu.html">
      <img alt="Une très bonne année… et de quoi lire un peu" height="320" src="http://img.over-blog-kiwi.com/940x320-ct/1/52/82/13/20160108/ob_da0c22_bonneanne2016.jpg" title="Une très bonne année… et de quoi lire un peu" width="940"/>
     </a>
     <a href="http://www.over-pair.com/2015/11/november-nine-pierre-neuville-termine-7e.html">
      <img alt="November Nine : Pierre Neuville termine 7e" height="320" src="http://img.over-blog-kiwi.com/940x320-ct/1/52/82/13/20151109/ob_ab2db6_22269285963-80d59dcd22-z.jpg" title="November Nine : Pierre Neuville termine 7e" width="940"/>
     </a>
     <a href="http://www.over-pair.com/2015/10/les-regles-officielles-du-poker-de-tournoi.html">
      <img alt="Les règles officielles du poker de tournoi" height="320" src="http://img.over-blog-kiwi.com/940x320-ct/1/52/82/13/20151104/ob_0096eb_amazon-room-wsop.jpg" title="Les règles officielles du poker de tournoi" width="940"/>
     </a>
     <a href="http://www.over-pair.com/2015/07/le-belge-pierre-neuville-en-finale-du-main-event-wsop.html">
      <img alt="Le Belge Pierre Neuville en finale du main event WSOP" height="320" src="http://img.over-blog-kiwi.com/940x320-ct/1/52/82/13/20150715/ob_238b64_19524583088-890dfa5ffb-z.jpg" title="Le Belge Pierre Neuville en finale du main event WSOP" width="940"/>
     </a>
     <a href="http://www.over-pair.com/2015/07/2015-des-wsop-surrealistes-pour-les-tricolores.html">
      <img alt="2015 : des WSOP surréalistes pour les tricolores" height="320" src="http://img.over-blog-kiwi.com/940x320-ct/1/52/82/13/20150712/ob_6b2fa9_leibgorin.jpg" title="2015 : des WSOP surréalistes pour les tricolores" width="940"/>
     </a>
    </div>
   </div>
   <div class="content-global clearfix">
    <section class="left-content" role="main">
     <article class="post clearfix">
      <a class="post-sidebox" href="http://www.over-pair.com/2018/05/un-francais-gagne-l-esp-monte-carlo.html" title="On se demandait qui serait le 10e Français à gagner un European Poker Tour… eh bien maintenant on le sait ! Il s'appelle Nicolas Dumont et empoche 712.000€ ! Et excusez du peu : c'est le plus prestigieux et aussi le plus difficile des EPT du circuit,...">
       <time class="post-date" data-hover="11/05/2018" datetime="2018-05-11T11:08:57+02:00">
        11 mai
       </time>
       <div class="post-cover">
        <img alt="Un Français gagne l'EPT Monte-Carlo" height="100" src="https://img.over-blog-kiwi.com/100x100-ct/1/52/82/13/20180511/ob_a24c11_capture-d-e-cran-2018-05-11-a-12.png" width="100"/>
       </div>
      </a>
      <div class="post-content">
       <header class="header">
        <h2 class="post-title">
         <a href="http://www.over-pair.com/2018/05/un-francais-gagne-l-esp-monte-carlo.html" title="On se demandait qui serait le 10e Français à gagner un European Poker Tour… eh bien maintenant on le sait ! Il s'appelle Nicolas Dumont et empoche 712.000€ ! Et excusez du peu : c'est le plus prestigieux et aussi le plus difficile des EPT du circuit,...">
          Un Français gagne l'EPT Monte-Carlo
         </a>
        </h2>
       </header>
       <div class="body clearfix">
        <p class="snippet">
         On se demandait qui serait le 10e Français à gagner un European Poker Tour… eh bien maintenant on le sait ! Il s'appelle Nicolas Dumont et empoche 712.000€ ! Et excusez du peu : c'est le plus prestigieux et aussi le plus difficile des EPT du circuit,...
        </p>
       </div>
       <p class="readmore">
        <a href="http://www.over-pair.com/2018/05/un-francais-gagne-l-esp-monte-carlo.html">
         Lire la suite
        </a>
       </p>
      </div>
     </article>
     <article class="post clearfix">
      <a class="post-sidebox" href="http://www.over-pair.com/2017/11/benjamin-pollack-et-antoine-saout-heros-du-poker-francais.html" title="On connaissait déjà leur combativité et leur art consommé de durer dans les tournois les plus durs. En se classant respectivement 3e et 5e du Main Event des WSOP 2017, ils créent un précédent qui devrait tenir de nombreuses années, à savoir placer deux...">
       <time class="post-date" data-hover="25/07/2017" datetime="2017-07-25T16:15:00+02:00">
        25 juil.
       </time>
       <div class="post-cover">
        <img alt="Benjamin Pollack et Antoine Saout au sommet du poker francais" height="100" src="https://img.over-blog-kiwi.com/100x100-ct/1/52/82/13/20171115/ob_240b5c_pollak.jpg" width="100"/>
       </div>
      </a>
      <div class="post-content">
       <header class="header">
        <h2 class="post-title">
         <a href="http://www.over-pair.com/2017/11/benjamin-pollack-et-antoine-saout-heros-du-poker-francais.html" title="On connaissait déjà leur combativité et leur art consommé de durer dans les tournois les plus durs. En se classant respectivement 3e et 5e du Main Event des WSOP 2017, ils créent un précédent qui devrait tenir de nombreuses années, à savoir placer deux...">
          Benjamin Pollack et Antoine Saout au sommet du poker francais
         </a>
        </h2>
       </header>
       <div class="body clearfix">
        <p class="snippet">
         On connaissait déjà leur combativité et leur art consommé de durer dans les tournois les plus durs. En se classant respectivement 3e et 5e du Main Event des WSOP 2017, ils créent un précédent qui devrait tenir de nombreuses années, à savoir placer deux...
        </p>
       </div>
       <p class="readmore">
        <a href="http://www.over-pair.com/2017/11/benjamin-pollack-et-antoine-saout-heros-du-poker-francais.html">
         Lire la suite
        </a>
       </p>
      </div>
     </article>
     <article class="post clearfix">
      <a class="post-sidebox" href="http://www.over-pair.com/2017/07/wsop-2-francais-en-finale-du-plus-grand-tournoi-de-poker-du-monde.html" title="Les amis, je suis sur un petit nuage… comme beaucoup ! Autant les WSOP ont été decevantes cette année pour les Francais (à part pour Fabrice Soulier qui a fait 2 TF, voir mes articles précédents), autant pour le main event, on est gâté comme on ne l'a...">
       <time class="post-date" data-hover="18/07/2017" datetime="2017-07-18T17:25:51+02:00">
        18 juil.
       </time>
       <div class="post-cover">
        <img alt="WSOP : 2 FRANCAIS EN FINALE DU PLUS GRAND TOURNOI DE POKER DU MONDE" height="100" src="https://img.over-blog-kiwi.com/100x100-ct/1/52/82/13/20170718/ob_455ba4_s1e44f59c78.jpg" width="100"/>
       </div>
      </a>
      <div class="post-content">
       <header class="header">
        <h2 class="post-title">
         <a href="http://www.over-pair.com/2017/07/wsop-2-francais-en-finale-du-plus-grand-tournoi-de-poker-du-monde.html" title="Les amis, je suis sur un petit nuage… comme beaucoup ! Autant les WSOP ont été decevantes cette année pour les Francais (à part pour Fabrice Soulier qui a fait 2 TF, voir mes articles précédents), autant pour le main event, on est gâté comme on ne l'a...">
          WSOP : 2 FRANCAIS EN FINALE DU PLUS GRAND TOURNOI DE POKER DU MONDE
         </a>
        </h2>
       </header>
       <div class="body clearfix">
        <p class="snippet">
         Les amis, je suis sur un petit nuage… comme beaucoup ! Autant les WSOP ont été decevantes cette année pour les Francais (à part pour Fabrice Soulier qui a fait 2 TF, voir mes articles précédents), autant pour le main event, on est gâté comme on ne l'a...
        </p>
       </div>
       <p class="readmore">
        <a href="http://www.over-pair.com/2017/07/wsop-2-francais-en-finale-du-plus-grand-tournoi-de-poker-du-monde.html">
         Lire la suite
        </a>
       </p>
      </div>
     </article>
     <article class="post clearfix">
      <a class="post-sidebox" href="http://www.over-pair.com/2017/06/poker-hall-of-fame-votez-pour-pierre-neuville.html" title="Pierre Neuville : ce nom est maintenant bien connu de tous les joueurs de poker du monde. C'est celui d'un Belge qui est aujourd'hui dans sa 74e année mais qui n'a jamais été aussi redoutable dans les grands tournois internationaux. Il accumule les places...">
       <time class="post-date" data-hover="20/06/2017" datetime="2017-06-20T15:22:06+02:00">
        20 juin
       </time>
       <div class="post-cover">
        <img alt="Poker Hall of Fame : votez pour Pierre Neuville !" height="100" src="https://img.over-blog-kiwi.com/100x100-ct/1/52/82/13/20170620/ob_66143e_pneuville-2.jpg" width="100"/>
       </div>
      </a>
      <div class="post-content">
       <header class="header">
        <h2 class="post-title">
         <a href="http://www.over-pair.com/2017/06/poker-hall-of-fame-votez-pour-pierre-neuville.html" title="Pierre Neuville : ce nom est maintenant bien connu de tous les joueurs de poker du monde. C'est celui d'un Belge qui est aujourd'hui dans sa 74e année mais qui n'a jamais été aussi redoutable dans les grands tournois internationaux. Il accumule les places...">
          Poker Hall of Fame : votez pour Pierre Neuville !
         </a>
        </h2>
       </header>
       <div class="body clearfix">
        <p class="snippet">
         Pierre Neuville : ce nom est maintenant bien connu de tous les joueurs de poker du monde. C'est celui d'un Belge qui est aujourd'hui dans sa 74e année mais qui n'a jamais été aussi redoutable dans les grands tournois internationaux. Il accumule les places...
        </p>
       </div>
       <p class="readmore">
        <a href="http://www.over-pair.com/2017/06/poker-hall-of-fame-votez-pour-pierre-neuville.html">
         Lire la suite
        </a>
       </p>
      </div>
     </article>
     <article class="post clearfix">
      <a class="post-sidebox" href="http://www.over-pair.com/2017/06/un-coup-de-poker-poour-aider-nos-amis-magiciens.html" title="Hello ! Je ne suis pas fan des pétitions en ligne car certaines cachent des intentions peu avouables. Mais ici, je vous en propose une vraiment utile. Il s'agit de protester contre la démolition prochaine d'un grand local (Patronage Laïque - Maison pour...">
       <time class="post-date" data-hover="19/06/2017" datetime="2017-06-19T09:42:20+02:00">
        19 juin
       </time>
       <div class="post-cover">
        <img alt="Un coup de poker pour aider nos amis magiciens" height="100" src="https://img.over-blog-kiwi.com/100x100-ct/1/52/82/13/20170619/ob_b94311_cfi1.png" width="100"/>
       </div>
      </a>
      <div class="post-content">
       <header class="header">
        <h2 class="post-title">
         <a href="http://www.over-pair.com/2017/06/un-coup-de-poker-poour-aider-nos-amis-magiciens.html" title="Hello ! Je ne suis pas fan des pétitions en ligne car certaines cachent des intentions peu avouables. Mais ici, je vous en propose une vraiment utile. Il s'agit de protester contre la démolition prochaine d'un grand local (Patronage Laïque - Maison pour...">
          Un coup de poker pour aider nos amis magiciens
         </a>
        </h2>
       </header>
       <div class="body clearfix">
        <p class="snippet">
         Hello ! Je ne suis pas fan des pétitions en ligne car certaines cachent des intentions peu avouables. Mais ici, je vous en propose une vraiment utile. Il s'agit de protester contre la démolition prochaine d'un grand local (Patronage Laïque - Maison pour...
        </p>
       </div>
       <p class="readmore">
        <a href="http://www.over-pair.com/2017/06/un-coup-de-poker-poour-aider-nos-amis-magiciens.html">
         Lire la suite
        </a>
       </p>
      </div>
     </article>
     <article class="post clearfix">
      <a class="post-sidebox" href="http://www.over-pair.com/2017/05/world-series-of-poker-2017-shuffle-up-and-deal.html" title="Ça y est, une fois de plus, les WSOP sont de retour ! Pour la 48e année consécutive, Las Vegas va illuminer la planète poker de tous ses feux pendant un bon mois un demi, jusqu’au 17 juillet prochain, la fin du Main Event à $10.000. Les organisateurs...">
       <time class="post-date" data-hover="31/05/2017" datetime="2017-05-31T20:14:53+02:00">
        31 mai
       </time>
       <div class="post-cover">
        <img alt="World Series Of Poker 2017 : shuffle up and deal" height="100" src="https://img.over-blog-kiwi.com/100x100-ct/1/52/82/13/20170531/ob_0e09fb_moss-ungar-brunson.jpg" width="100"/>
       </div>
      </a>
      <div class="post-content">
       <header class="header">
        <h2 class="post-title">
         <a href="http://www.over-pair.com/2017/05/world-series-of-poker-2017-shuffle-up-and-deal.html" title="Ça y est, une fois de plus, les WSOP sont de retour ! Pour la 48e année consécutive, Las Vegas va illuminer la planète poker de tous ses feux pendant un bon mois un demi, jusqu’au 17 juillet prochain, la fin du Main Event à $10.000. Les organisateurs...">
          World Series Of Poker 2017 : shuffle up and deal
         </a>
        </h2>
       </header>
       <div class="body clearfix">
        <p class="snippet">
         Ça y est, une fois de plus, les WSOP sont de retour ! Pour la 48e année consécutive, Las Vegas va illuminer la planète poker de tous ses feux pendant un bon mois un demi, jusqu’au 17 juillet prochain, la fin du Main Event à $10.000. Les organisateurs...
        </p>
       </div>
       <p class="readmore">
        <a href="http://www.over-pair.com/2017/05/world-series-of-poker-2017-shuffle-up-and-deal.html">
         Lire la suite
        </a>
       </p>
      </div>
     </article>
     <article class="post clearfix">
      <a class="post-sidebox" href="http://www.over-pair.com/2017/06/de-nouveaux-clubs-de-poker-a-paris-des-janvier-2018.html" title="Enfin une bonne nouvelle du côté de l’offre de jeux. Pour une fois, les choses n’ont pas traîné en matière législative, puisque dans le dernier Journal Officiel de la mandature Hollande (du 10/05/2017) est paru le décret d’application de la loi qui crée...">
       <time class="post-date" data-hover="14/05/2017" datetime="2017-05-14T23:27:00+02:00">
        14 mai
       </time>
       <div class="post-cover">
        <img alt="De nouveaux clubs de poker à Paris dès janvier 2018" height="100" src="https://img.over-blog-kiwi.com/100x100-ct/1/52/82/13/20170601/ob_5c4122_240522-web.jpg" width="100"/>
       </div>
      </a>
      <div class="post-content">
       <header class="header">
        <h2 class="post-title">
         <a href="http://www.over-pair.com/2017/06/de-nouveaux-clubs-de-poker-a-paris-des-janvier-2018.html" title="Enfin une bonne nouvelle du côté de l’offre de jeux. Pour une fois, les choses n’ont pas traîné en matière législative, puisque dans le dernier Journal Officiel de la mandature Hollande (du 10/05/2017) est paru le décret d’application de la loi qui crée...">
          De nouveaux clubs de poker à Paris dès janvier 2018
         </a>
        </h2>
       </header>
       <div class="body clearfix">
        <p class="snippet">
         Enfin une bonne nouvelle du côté de l’offre de jeux. Pour une fois, les choses n’ont pas traîné en matière législative, puisque dans le dernier Journal Officiel de la mandature Hollande (du 10/05/2017) est paru le décret d’application de la loi qui crée...
        </p>
       </div>
       <p class="readmore">
        <a href="http://www.over-pair.com/2017/06/de-nouveaux-clubs-de-poker-a-paris-des-janvier-2018.html">
         Lire la suite
        </a>
       </p>
      </div>
     </article>
     <article class="post clearfix">
      <a a="" ce="" class="post-sidebox" d="" dans="" de="" href="http://www.over-pair.com/2017/04/poker-sport-ou-pas-sport.html" l="" mais...="" module="" mon="" n="" pas="" philosophique="" que="" recherche.="" sport="" title="Cette question est un véritable serpent de mer qui revient régulièrement, et vous en trouverez de nombreuses réponses dans ce blog si vous faites la recherche ">
       <time class="post-date" data-hover="18/04/2017" datetime="2017-04-18T12:29:32+02:00">
        18 avr.
       </time>
       <div class="post-cover">
        <img alt="Poker : sport ou pas sport ?" height="100" src="http://resize.over-blog.com/100x100-ct.jpg?https://i.ytimg.com/vi/sAI-X6-kHsg/hqdefault.jpg" width="100"/>
       </div>
      </a>
      <div class="post-content">
       <header class="header">
        <h2 class="post-title">
         <a href="http://www.over-pair.com/2017/04/poker-sport-ou-pas-sport.html" title="Cette question est un véritable serpent de mer qui revient régulièrement, et vous en trouverez de nombreuses réponses dans ce blog si vous faites la recherche &quot;sport&quot; dans mon module de recherche. A l'origine, ce débat n'était pas que philosophique, mais...">
          Poker : sport ou pas sport ?
         </a>
        </h2>
       </header>
       <div class="body clearfix">
        <p class="snippet">
         Cette question est un véritable serpent de mer qui revient régulièrement, et vous en trouverez de nombreuses réponses dans ce blog si vous faites la recherche "sport" dans mon module de recherche. A l'origine, ce débat n'était pas que philosophique, mais...
        </p>
       </div>
       <p class="readmore">
        <a href="http://www.over-pair.com/2017/04/poker-sport-ou-pas-sport.html">
         Lire la suite
        </a>
       </p>
      </div>
     </article>
     <article class="post clearfix">
      <a :="" adversaires="" aux="" bo="" class="post-sidebox" de="" face="" href="http://www.over-pair.com/2017/05/le-poker-de-la-mort.html" les="" nos="" pires="" plus="" poker="" qui="" redoutables="" soient="" table="" title="Vous n'avez pas peur de la mort ? Et vous n'avez pas peur de mourir de rire ? Alors allez-y, faites " une="" voisins="">
       <time class="post-date" data-hover="15/03/2017" datetime="2017-03-15T22:58:00+01:00">
        15 mars
       </time>
       <div class="post-cover">
        <img alt="Le poker de la mort !" height="100" src="http://resize.over-blog.com/100x100-ct.jpg?https://images.6play.fr/v1/images/347118/raw?width=1120&amp;height=630&amp;fit=scale&amp;crop=center&amp;hash=5dd25863ef8b1cf930eb2319c5ad5d845dc57acb" width="100"/>
       </div>
      </a>
      <div class="post-content">
       <header class="header">
        <h2 class="post-title">
         <a href="http://www.over-pair.com/2017/05/le-poker-de-la-mort.html" title="Vous n'avez pas peur de la mort ? Et vous n'avez pas peur de mourir de rire ? Alors allez-y, faites &quot;boîte&quot; face aux adversaires les plus redoutables qui soient à une table de poker : nos pires voisins !">
          Le poker de la mort !
         </a>
        </h2>
       </header>
       <div class="body clearfix">
        <p class="snippet">
         Vous n'avez pas peur de la mort ? Et vous n'avez pas peur de mourir de rire ? Alors allez-y, faites "boîte" face aux adversaires les plus redoutables qui soient à une table de poker : nos pires voisins !
        </p>
       </div>
       <p class="readmore">
        <a href="http://www.over-pair.com/2017/05/le-poker-de-la-mort.html">
         Lire la suite
        </a>
       </p>
      </div>
     </article>
     <article class="post clearfix">
      <a class="post-sidebox" href="http://www.over-pair.com/2017/03/une-couverture-entierement-redessinee-les-probabilites-et-d-une-maniere-generale-les-chiffres-constituent-un-sujet-sensible-au-poker" title="Une couverture entièrement redessinée
Les probabilités et, d'une manière générale, les CHIFFRES constituent un sujet sensible au poker, pour la simple raison qu'en gros, les Francais sont nuls en maths. Pardon d'être aussi brutal, mais ce n'est pas parce...">
       <time class="post-date" data-hover="01/03/2017" datetime="2017-03-01T15:03:56+01:00">
        1 mars
       </time>
       <div class="post-cover">
        <img alt="Essentiel des Probabilités au Poker : la nouvelle version est disponible" height="100" src="https://img.over-blog-kiwi.com/100x100-ct/1/52/82/13/20170301/ob_2b54d2_essentiel-probabilites-poker-c1-lr.jpg" width="100"/>
       </div>
      </a>
      <div class="post-content">
       <header class="header">
        <h2 class="post-title">
         <a href="http://www.over-pair.com/2017/03/une-couverture-entierement-redessinee-les-probabilites-et-d-une-maniere-generale-les-chiffres-constituent-un-sujet-sensible-au-poker" title="Une couverture entièrement redessinée
Les probabilités et, d'une manière générale, les CHIFFRES constituent un sujet sensible au poker, pour la simple raison qu'en gros, les Francais sont nuls en maths. Pardon d'être aussi brutal, mais ce n'est pas parce...">
          Essentiel des Probabilités au Poker : la nouvelle version est disponible
         </a>
        </h2>
       </header>
       <div class="body clearfix">
        <p class="snippet">
         Une couverture entièrement redessinée
Les probabilités et, d'une manière générale, les CHIFFRES constituent un sujet sensible au poker, pour la simple raison qu'en gros, les Francais sont nuls en maths. Pardon d'être aussi brutal, mais ce n'est pas parce...
        </p>
       </div>
       <p class="readmore">
        <a href="http://www.over-pair.com/2017/03/une-couverture-entierement-redessinee-les-probabilites-et-d-une-maniere-generale-les-chiffres-constituent-un-sujet-sensible-au-poker">
         Lire la suite
        </a>
       </p>
      </div>
     </article>
     <article class="post clearfix">
      <a class="post-sidebox" href="http://www.over-pair.com/2017/02/le-club-anglais-contraint-de-fermer.html" title="A vrai dire, cela ne m'étonne pas qu'un des deux derniers cercles parisiens soit contraint de fermer. Il y a dans ces institutions d'un autre âge (loi de 1901 paraît-il) une telle tentation (de masses) d'argent facile qu'on finit toujours par trouver...">
       <time class="post-date" data-hover="21/02/2017" datetime="2017-02-21T16:36:57+01:00">
        21 févr.
       </time>
       <div class="post-cover">
        <img alt="Le Club Anglais contraint de fermer" height="100" src="https://img.over-blog-kiwi.com/100x100-ct/1/52/82/13/20170221/ob_47b6ca_les-tontons-flingueurs.jpg" width="100"/>
       </div>
      </a>
      <div class="post-content">
       <header class="header">
        <h2 class="post-title">
         <a href="http://www.over-pair.com/2017/02/le-club-anglais-contraint-de-fermer.html" title="A vrai dire, cela ne m'étonne pas qu'un des deux derniers cercles parisiens soit contraint de fermer. Il y a dans ces institutions d'un autre âge (loi de 1901 paraît-il) une telle tentation (de masses) d'argent facile qu'on finit toujours par trouver...">
          Le Club Anglais contraint de fermer
         </a>
        </h2>
       </header>
       <div class="body clearfix">
        <p class="snippet">
         A vrai dire, cela ne m'étonne pas qu'un des deux derniers cercles parisiens soit contraint de fermer. Il y a dans ces institutions d'un autre âge (loi de 1901 paraît-il) une telle tentation (de masses) d'argent facile qu'on finit toujours par trouver...
        </p>
       </div>
       <p class="readmore">
        <a href="http://www.over-pair.com/2017/02/le-club-anglais-contraint-de-fermer.html">
         Lire la suite
        </a>
       </p>
      </div>
     </article>
     <article class="post clearfix">
      <a class="post-sidebox" href="http://www.over-pair.com/2017/02/c-est-fait-l-intelligence-artificielle-bat-l-homme-au-poker-a-deux.html" title="Cette fois on y est. Le robot est meilleur que l’homme au poker, mais, précisons-le, uniquement en heads-up – en tout cas pour le moment. Pour le shorthanded (5 ou 6 joueurs) ou la table pleine (9 ou 10 joueurs), il faudra patienter – mais ça viendra...">
       <time class="post-date" data-hover="07/02/2017" datetime="2017-02-07T12:18:28+01:00">
        7 févr.
       </time>
       <div class="post-cover">
        <img alt="C’est fait : l’intelligence artificielle bat l’homme au poker à deux" height="100" src="https://img.over-blog-kiwi.com/100x100-ct/1/52/82/13/20170207/ob_8b89da_libratus2017.jpg" width="100"/>
       </div>
      </a>
      <div class="post-content">
       <header class="header">
        <h2 class="post-title">
         <a href="http://www.over-pair.com/2017/02/c-est-fait-l-intelligence-artificielle-bat-l-homme-au-poker-a-deux.html" title="Cette fois on y est. Le robot est meilleur que l’homme au poker, mais, précisons-le, uniquement en heads-up – en tout cas pour le moment. Pour le shorthanded (5 ou 6 joueurs) ou la table pleine (9 ou 10 joueurs), il faudra patienter – mais ça viendra...">
          C’est fait : l’intelligence artificielle bat l’homme au poker à deux
         </a>
        </h2>
       </header>
       <div class="body clearfix">
        <p class="snippet">
         Cette fois on y est. Le robot est meilleur que l’homme au poker, mais, précisons-le, uniquement en heads-up – en tout cas pour le moment. Pour le shorthanded (5 ou 6 joueurs) ou la table pleine (9 ou 10 joueurs), il faudra patienter – mais ça viendra...
        </p>
       </div>
       <p class="readmore">
        <a href="http://www.over-pair.com/2017/02/c-est-fait-l-intelligence-artificielle-bat-l-homme-au-poker-a-deux.html">
         Lire la suite
        </a>
       </p>
      </div>
     </article>
     <article class="post clearfix">
      <a class="post-sidebox" href="http://www.over-pair.com/2017/01/un-petit-poke-meilleurs-voeux-2017-a-tous.html" title="Pour illustrer mes vœux pokériens 2017, j'ai choisi ce dessin de Gotlib, extrait de son épatant Gods'club, que vous retrouverez notamment dans le Fluide Glacial spécial Gotlib paru en début d'année. Parce que Gotlib, disparu le 4 décembre 2016, fait partie...">
       <time class="post-date" data-hover="07/01/2017" datetime="2017-01-07T13:00:23+01:00">
        7 janv.
       </time>
       <div class="post-cover">
        <img alt='"Un petit poke ?" Meilleurs vœux 2017 à tous !' height="100" src="https://img.over-blog-kiwi.com/100x100-ct/1/52/82/13/20170108/ob_60861f_pokergotlib.jpg" width="100"/>
       </div>
      </a>
      <div class="post-content">
       <header class="header">
        <h2 class="post-title">
         <a href="http://www.over-pair.com/2017/01/un-petit-poke-meilleurs-voeux-2017-a-tous.html" title="Pour illustrer mes vœux pokériens 2017, j'ai choisi ce dessin de Gotlib, extrait de son épatant Gods'club, que vous retrouverez notamment dans le Fluide Glacial spécial Gotlib paru en début d'année. Parce que Gotlib, disparu le 4 décembre 2016, fait partie...">
          "Un petit poke ?" Meilleurs vœux 2017 à tous !
         </a>
        </h2>
       </header>
       <div class="body clearfix">
        <p class="snippet">
         Pour illustrer mes vœux pokériens 2017, j'ai choisi ce dessin de Gotlib, extrait de son épatant Gods'club, que vous retrouverez notamment dans le Fluide Glacial spécial Gotlib paru en début d'année. Parce que Gotlib, disparu le 4 décembre 2016, fait partie...
        </p>
       </div>
       <p class="readmore">
        <a href="http://www.over-pair.com/2017/01/un-petit-poke-meilleurs-voeux-2017-a-tous.html">
         Lire la suite
        </a>
       </p>
      </div>
     </article>
     <article class="post clearfix">
      <a class="post-sidebox" href="http://www.over-pair.com/2016/12/poker-omaha-a-deauville.html" title="Vendredi dernier s'est déroulé le PLO 300 dans le cadre du World Poker Tour National de Deauville. Avant d'en dire plus, je me réjouis de voir que grâce au WPT, Deauville conserve un statut de place internationale de poker, même si on est loin de l'EPT...">
       <time class="post-date" data-hover="14/12/2016" datetime="2016-12-14T09:18:45+01:00">
        14 déc.
       </time>
       <div class="post-cover">
        <img alt="Poker Omaha à Deauville" height="100" src="https://img.over-blog-kiwi.com/100x100-ct/1/52/82/13/20161214/ob_8f9380_20161210-101810.jpg" width="100"/>
       </div>
      </a>
      <div class="post-content">
       <header class="header">
        <h2 class="post-title">
         <a href="http://www.over-pair.com/2016/12/poker-omaha-a-deauville.html" title="Vendredi dernier s'est déroulé le PLO 300 dans le cadre du World Poker Tour National de Deauville. Avant d'en dire plus, je me réjouis de voir que grâce au WPT, Deauville conserve un statut de place internationale de poker, même si on est loin de l'EPT...">
          Poker Omaha à Deauville
         </a>
        </h2>
       </header>
       <div class="body clearfix">
        <p class="snippet">
         Vendredi dernier s'est déroulé le PLO 300 dans le cadre du World Poker Tour National de Deauville. Avant d'en dire plus, je me réjouis de voir que grâce au WPT, Deauville conserve un statut de place internationale de poker, même si on est loin de l'EPT...
        </p>
       </div>
       <p class="readmore">
        <a href="http://www.over-pair.com/2016/12/poker-omaha-a-deauville.html">
         Lire la suite
        </a>
       </p>
      </div>
     </article>
     <article class="post clearfix">
      <a class="post-sidebox" href="http://www.over-pair.com/2016/11/autour-de-la-nouvelle-version-de-ce-blog.html" non="" seulement...="" template="" title="Longtemps, longtemps j'ai hésité avant de modifier l'apparence de mon blog. Et puis, après plus de dix ans, je me suis résolu à le faire. On en est à la version 3.0. Mais ce que je n'avais pas bien compris, c'est qu'en changeant de ">
       <time class="post-date" data-hover="21/11/2016" datetime="2016-11-21T01:51:03+01:00">
        21 nov.
       </time>
       <div class="post-cover">
        <img alt="Autour de la nouvelle version du blog Over-pair.com" height="100" src="https://img.over-blog-kiwi.com/100x100-ct/1/52/82/13/20161121/ob_e07ad2_fm-ladysmile-20150611-jpg.jpg" width="100"/>
       </div>
      </a>
      <div class="post-content">
       <header class="header">
        <h2 class="post-title">
         <a href="http://www.over-pair.com/2016/11/autour-de-la-nouvelle-version-de-ce-blog.html" title="Longtemps, longtemps j'ai hésité avant de modifier l'apparence de mon blog. Et puis, après plus de dix ans, je me suis résolu à le faire. On en est à la version 3.0. Mais ce que je n'avais pas bien compris, c'est qu'en changeant de &quot;template&quot;, non seulement...">
          Autour de la nouvelle version du blog Over-pair.com
         </a>
        </h2>
       </header>
       <div class="body clearfix">
        <p class="snippet">
         Longtemps, longtemps j'ai hésité avant de modifier l'apparence de mon blog. Et puis, après plus de dix ans, je me suis résolu à le faire. On en est à la version 3.0. Mais ce que je n'avais pas bien compris, c'est qu'en changeant de "template", non seulement...
        </p>
       </div>
       <p class="readmore">
        <a href="http://www.over-pair.com/2016/11/autour-de-la-nouvelle-version-de-ce-blog.html">
         Lire la suite
        </a>
       </p>
      </div>
     </article>
     <article class="post clearfix">
      <a class="post-sidebox" href="http://www.over-pair.com/2016/10/wsop-circuit-paris.html" title="Les WSOP ont aussi leur circuit international, ne l'oublions pas, et le dernier cercle de poker francais les accueille en novembre ! Elles se déroulent du 11 au 28 novembre au Cercle Clichy Montmartre, et le clou du spectacle sera à la fin, avec le main...">
       <time class="post-date" data-hover="26/10/2016" datetime="2016-10-26T00:36:54+02:00">
        26 oct.
       </time>
       <div class="post-cover">
        <img alt="WSOP Circuit - Paris" height="100" src="https://img.over-blog-kiwi.com/100x100-ct/1/52/82/13/20161026/ob_cb003b_wsop-international-circuit-schedule-he.jpg" width="100"/>
       </div>
      </a>
      <div class="post-content">
       <header class="header">
        <h2 class="post-title">
         <a href="http://www.over-pair.com/2016/10/wsop-circuit-paris.html" title="Les WSOP ont aussi leur circuit international, ne l'oublions pas, et le dernier cercle de poker francais les accueille en novembre ! Elles se déroulent du 11 au 28 novembre au Cercle Clichy Montmartre, et le clou du spectacle sera à la fin, avec le main...">
          WSOP Circuit - Paris
         </a>
        </h2>
       </header>
       <div class="body clearfix">
        <p class="snippet">
         Les WSOP ont aussi leur circuit international, ne l'oublions pas, et le dernier cercle de poker francais les accueille en novembre ! Elles se déroulent du 11 au 28 novembre au Cercle Clichy Montmartre, et le clou du spectacle sera à la fin, avec le main...
        </p>
       </div>
       <p class="readmore">
        <a href="http://www.over-pair.com/2016/10/wsop-circuit-paris.html">
         Lire la suite
        </a>
       </p>
      </div>
     </article>
     <article class="post clearfix">
      <a class="post-sidebox" href="http://www.over-pair.com/2016/10/un-coup-de-pouce-pour-natural-born-player.html" title="Pour favoriser l'éclosion d'un court-métrage de fiction consacré au poker, faites donc un don, même petit, à Ayesha Carmody, qui se charge de la réalisation ! En fonction du montant de votre aide (à partir d'un chip de… 5€!), vous obtiendrez un grade...">
       <time class="post-date" data-hover="17/10/2016" datetime="2016-10-17T10:09:36+02:00">
        17 oct.
       </time>
       <div class="post-cover">
        <img alt='Un coup de pouce pour "Natural Born Player"' height="100" src="https://img.over-blog-kiwi.com/100x100-ct/1/52/82/13/20161017/ob_34e5a0_naturalbornplayer.png" width="100"/>
       </div>
      </a>
      <div class="post-content">
       <header class="header">
        <h2 class="post-title">
         <a href="http://www.over-pair.com/2016/10/un-coup-de-pouce-pour-natural-born-player.html" title="Pour favoriser l'éclosion d'un court-métrage de fiction consacré au poker, faites donc un don, même petit, à Ayesha Carmody, qui se charge de la réalisation ! En fonction du montant de votre aide (à partir d'un chip de… 5€!), vous obtiendrez un grade...">
          Un coup de pouce pour "Natural Born Player"
         </a>
        </h2>
       </header>
       <div class="body clearfix">
        <p class="snippet">
         Pour favoriser l'éclosion d'un court-métrage de fiction consacré au poker, faites donc un don, même petit, à Ayesha Carmody, qui se charge de la réalisation ! En fonction du montant de votre aide (à partir d'un chip de… 5€!), vous obtiendrez un grade...
        </p>
       </div>
       <p class="readmore">
        <a href="http://www.over-pair.com/2016/10/un-coup-de-pouce-pour-natural-born-player.html">
         Lire la suite
        </a>
       </p>
      </div>
     </article>
     <article class="post clearfix">
      <a class="post-sidebox" href="http://www.over-pair.com/2016/06/une-carte-d-un-demi-million-de-dollars.html" title="Une très jolie photo signée Antonio Abrego. Elle montre Lisa Meredith et Jason DeWitt, dans le trio final du Millionaire Maker, 14e tournoi des World Series Of Poker qui vient de se terminer. Il en émane une certaine dose de pathétique. Et pour cause...">
       <time class="post-date" data-hover="15/06/2016" datetime="2016-06-15T22:48:16+02:00">
        15 juin
       </time>
       <div class="post-cover">
        <img alt="Une carte d'un demi-million de dollars" height="100" src="http://img.over-blog-kiwi.com/100x100-ct/1/52/82/13/20160615/ob_41db20_27605305161-886656f928-z.jpg" width="100"/>
       </div>
      </a>
      <div class="post-content">
       <header class="header">
        <h2 class="post-title">
         <a href="http://www.over-pair.com/2016/06/une-carte-d-un-demi-million-de-dollars.html" title="Une très jolie photo signée Antonio Abrego. Elle montre Lisa Meredith et Jason DeWitt, dans le trio final du Millionaire Maker, 14e tournoi des World Series Of Poker qui vient de se terminer. Il en émane une certaine dose de pathétique. Et pour cause...">
          Une carte d'un demi-million de dollars
         </a>
        </h2>
       </header>
       <div class="body clearfix">
        <p class="snippet">
         Une très jolie photo signée Antonio Abrego. Elle montre Lisa Meredith et Jason DeWitt, dans le trio final du Millionaire Maker, 14e tournoi des World Series Of Poker qui vient de se terminer. Il en émane une certaine dose de pathétique. Et pour cause...
        </p>
       </div>
       <p class="readmore">
        <a href="http://www.over-pair.com/2016/06/une-carte-d-un-demi-million-de-dollars.html">
         Lire la suite
        </a>
       </p>
      </div>
     </article>
     <article class="post clearfix">
      <a class="post-sidebox" href="http://www.over-pair.com/2016/06/jouer-au-poker-debout-dans-un-cube.html" title="Jetez donc un coup d'oeil aux GPL Summer Series de Global Poker Index, où les matches en tête-à-tête se font debout l'un en face de l'autre, dans une sorte de cube aux arètes lumineuses ! Ici le match Fabrice Soulier / AAron Paul, juste 3h de long… Expérience...">
       <time class="post-date" data-hover="09/06/2016" datetime="2016-06-09T09:12:06+02:00">
        9 juin
       </time>
       <div class="post-cover">
        <img alt="Jouer au poker debout dans un cube !" height="100" src="http://img.over-blog-kiwi.com/100x100-ct/1/52/82/13/20160609/ob_20b393_gpl-hu.png" width="100"/>
       </div>
      </a>
      <div class="post-content">
       <header class="header">
        <h2 class="post-title">
         <a href="http://www.over-pair.com/2016/06/jouer-au-poker-debout-dans-un-cube.html" title="Jetez donc un coup d'oeil aux GPL Summer Series de Global Poker Index, où les matches en tête-à-tête se font debout l'un en face de l'autre, dans une sorte de cube aux arètes lumineuses ! Ici le match Fabrice Soulier / AAron Paul, juste 3h de long… Expérience...">
          Jouer au poker debout dans un cube !
         </a>
        </h2>
       </header>
       <div class="body clearfix">
        <p class="snippet">
         Jetez donc un coup d'oeil aux GPL Summer Series de Global Poker Index, où les matches en tête-à-tête se font debout l'un en face de l'autre, dans une sorte de cube aux arètes lumineuses ! Ici le match Fabrice Soulier / AAron Paul, juste 3h de long… Expérience...
        </p>
       </div>
       <p class="readmore">
        <a href="http://www.over-pair.com/2016/06/jouer-au-poker-debout-dans-un-cube.html">
         Lire la suite
        </a>
       </p>
      </div>
     </article>
     <article class="post clearfix">
      <a class="post-sidebox" href="http://www.over-pair.com/2016/04/paul-daniels-disparait.html" title="Le magicien-entertainer anglais PAUL DANIELS nous a quittés récemment. C'était un maître parmi les maîtres, très respecté de ses pairs, et surtout un grand connaisseur des méthodes de tricherie, et pas seulement aux cartes ! J'avais eu la chance de croiser...">
       <time class="post-date" data-hover="22/04/2016" datetime="2016-04-22T11:50:15+02:00">
        22 avr.
       </time>
       <div class="post-cover">
        <img alt="Paul Daniels disparaît" height="100" src="https://img.over-blog-kiwi.com/100x100-ct/1/52/82/13/20161121/ob_b5a230_paul-daniels-headshot.jpg" width="100"/>
       </div>
      </a>
      <div class="post-content">
       <header class="header">
        <h2 class="post-title">
         <a href="http://www.over-pair.com/2016/04/paul-daniels-disparait.html" title="Le magicien-entertainer anglais PAUL DANIELS nous a quittés récemment. C'était un maître parmi les maîtres, très respecté de ses pairs, et surtout un grand connaisseur des méthodes de tricherie, et pas seulement aux cartes ! J'avais eu la chance de croiser...">
          Paul Daniels disparaît
         </a>
        </h2>
       </header>
       <div class="body clearfix">
        <p class="snippet">
         Le magicien-entertainer anglais PAUL DANIELS nous a quittés récemment. C'était un maître parmi les maîtres, très respecté de ses pairs, et surtout un grand connaisseur des méthodes de tricherie, et pas seulement aux cartes ! J'avais eu la chance de croiser...
        </p>
       </div>
       <p class="readmore">
        <a href="http://www.over-pair.com/2016/04/paul-daniels-disparait.html">
         Lire la suite
        </a>
       </p>
      </div>
     </article>
     <article class="post clearfix">
      <a class="post-sidebox" href="http://www.over-pair.com/2016/01/une-tres-bonne-annee-et-de-quoi-lire-un-peu.html" title="Prenons les sujets dans l'ordre. On en a tellement bavé en 2015 qu'on avait hâte de tester une autre année, pour voir. Alors pourquoi pas 2016, et comme un flop et sa carte brûlée, je me suis amusé à en faire une photo. Donc oui, amies et amis, bonne...">
       <time class="post-date" data-hover="08/01/2016" datetime="2016-01-08T00:10:45+01:00">
        8 janv.
       </time>
       <div class="post-cover">
        <img alt="Une très bonne année… et de quoi lire un peu" height="100" src="http://img.over-blog-kiwi.com/100x100-ct/1/52/82/13/20160108/ob_da0c22_bonneanne2016.jpg" width="100"/>
       </div>
      </a>
      <div class="post-content">
       <header class="header">
        <h2 class="post-title">
         <a href="http://www.over-pair.com/2016/01/une-tres-bonne-annee-et-de-quoi-lire-un-peu.html" title="Prenons les sujets dans l'ordre. On en a tellement bavé en 2015 qu'on avait hâte de tester une autre année, pour voir. Alors pourquoi pas 2016, et comme un flop et sa carte brûlée, je me suis amusé à en faire une photo. Donc oui, amies et amis, bonne...">
          Une très bonne année… et de quoi lire un peu
         </a>
        </h2>
       </header>
       <div class="body clearfix">
        <p class="snippet">
         Prenons les sujets dans l'ordre. On en a tellement bavé en 2015 qu'on avait hâte de tester une autre année, pour voir. Alors pourquoi pas 2016, et comme un flop et sa carte brûlée, je me suis amusé à en faire une photo. Donc oui, amies et amis, bonne...
        </p>
       </div>
       <p class="readmore">
        <a href="http://www.over-pair.com/2016/01/une-tres-bonne-annee-et-de-quoi-lire-un-peu.html">
         Lire la suite
        </a>
       </p>
      </div>
     </article>
     <article class="post clearfix">
      <a class="post-sidebox" href="http://www.over-pair.com/2015/11/november-nine-pierre-neuville-termine-7e.html" title="Ce matin vers 6h30 heure de Paris, après environ 4h de jeu, dans la 72e main, Pierre Neuville a fini par jeter l'éponge face à un Joe McKeehen mega-chip-leader. Celui-ci avait payé le all-in sans conviction avec Jh6h, contre Pierre qui abat avec soulagement...">
       <time class="post-date" data-hover="09/11/2015" datetime="2015-11-09T14:44:43+01:00">
        9 nov.
       </time>
       <div class="post-cover">
        <img alt="November Nine : Pierre Neuville termine 7e" height="100" src="http://img.over-blog-kiwi.com/100x100-ct/1/52/82/13/20151109/ob_ab2db6_22269285963-80d59dcd22-z.jpg" width="100"/>
       </div>
      </a>
      <div class="post-content">
       <header class="header">
        <h2 class="post-title">
         <a href="http://www.over-pair.com/2015/11/november-nine-pierre-neuville-termine-7e.html" title="Ce matin vers 6h30 heure de Paris, après environ 4h de jeu, dans la 72e main, Pierre Neuville a fini par jeter l'éponge face à un Joe McKeehen mega-chip-leader. Celui-ci avait payé le all-in sans conviction avec Jh6h, contre Pierre qui abat avec soulagement...">
          November Nine : Pierre Neuville termine 7e
         </a>
        </h2>
       </header>
       <div class="body clearfix">
        <p class="snippet">
         Ce matin vers 6h30 heure de Paris, après environ 4h de jeu, dans la 72e main, Pierre Neuville a fini par jeter l'éponge face à un Joe McKeehen mega-chip-leader. Celui-ci avait payé le all-in sans conviction avec Jh6h, contre Pierre qui abat avec soulagement...
        </p>
       </div>
       <p class="readmore">
        <a href="http://www.over-pair.com/2015/11/november-nine-pierre-neuville-termine-7e.html">
         Lire la suite
        </a>
       </p>
      </div>
     </article>
     <article class="post clearfix">
      <a class="post-sidebox" href="http://www.over-pair.com/2015/10/les-regles-officielles-du-poker-de-tournoi.html" title="Ça y est, il est paru ! Dans un seul livre de moins de 150 pages, toutes les règles spécifiques aux tournois de poker, respectueuses des préconisations de la TDA (Tournament Directors Association). C'est au printemps que je me suis rapproché du Club des...">
       <time class="post-date" data-hover="04/10/2015" datetime="2015-10-04T10:27:28+02:00">
        4 oct.
       </time>
       <div class="post-cover">
        <img alt="Les règles officielles du poker de tournoi" height="100" src="http://img.over-blog-kiwi.com/100x100-ct/1/52/82/13/20151104/ob_0096eb_amazon-room-wsop.jpg" width="100"/>
       </div>
      </a>
      <div class="post-content">
       <header class="header">
        <h2 class="post-title">
         <a href="http://www.over-pair.com/2015/10/les-regles-officielles-du-poker-de-tournoi.html" title="Ça y est, il est paru ! Dans un seul livre de moins de 150 pages, toutes les règles spécifiques aux tournois de poker, respectueuses des préconisations de la TDA (Tournament Directors Association). C'est au printemps que je me suis rapproché du Club des...">
          Les règles officielles du poker de tournoi
         </a>
        </h2>
       </header>
       <div class="body clearfix">
        <p class="snippet">
         Ça y est, il est paru ! Dans un seul livre de moins de 150 pages, toutes les règles spécifiques aux tournois de poker, respectueuses des préconisations de la TDA (Tournament Directors Association). C'est au printemps que je me suis rapproché du Club des...
        </p>
       </div>
       <p class="readmore">
        <a href="http://www.over-pair.com/2015/10/les-regles-officielles-du-poker-de-tournoi.html">
         Lire la suite
        </a>
       </p>
      </div>
     </article>
     <article class="post clearfix">
      <a class="post-sidebox" href="http://www.over-pair.com/2015/07/le-belge-pierre-neuville-en-finale-du-main-event-wsop.html" title="Dans le plus grand tournoi de poker du monde, le Main Event des World Series Of Poker (WSOP), ils étaient 6.420 au départ, ils ne sont plus que 9 ! A Las Vegas, après l'élimination de l'Allemand Alexander Turyansky, voici maintenant les finalistes par...">
       <time class="post-date" data-hover="15/07/2015" datetime="2015-07-15T09:45:45+02:00">
        15 juil.
       </time>
       <div class="post-cover">
        <img alt="Le Belge Pierre Neuville en finale du main event WSOP" height="100" src="http://img.over-blog-kiwi.com/100x100-ct/1/52/82/13/20150715/ob_238b64_19524583088-890dfa5ffb-z.jpg" width="100"/>
       </div>
      </a>
      <div class="post-content">
       <header class="header">
        <h2 class="post-title">
         <a href="http://www.over-pair.com/2015/07/le-belge-pierre-neuville-en-finale-du-main-event-wsop.html" title="Dans le plus grand tournoi de poker du monde, le Main Event des World Series Of Poker (WSOP), ils étaient 6.420 au départ, ils ne sont plus que 9 ! A Las Vegas, après l'élimination de l'Allemand Alexander Turyansky, voici maintenant les finalistes par...">
          Le Belge Pierre Neuville en finale du main event WSOP
         </a>
        </h2>
       </header>
       <div class="body clearfix">
        <p class="snippet">
         Dans le plus grand tournoi de poker du monde, le Main Event des World Series Of Poker (WSOP), ils étaient 6.420 au départ, ils ne sont plus que 9 ! A Las Vegas, après l'élimination de l'Allemand Alexander Turyansky, voici maintenant les finalistes par...
        </p>
       </div>
       <p class="readmore">
        <a href="http://www.over-pair.com/2015/07/le-belge-pierre-neuville-en-finale-du-main-event-wsop.html">
         Lire la suite
        </a>
       </p>
      </div>
     </article>
     <article class="post clearfix">
      <a class="post-sidebox" href="http://www.over-pair.com/2015/07/2015-des-wsop-surrealistes-pour-les-tricolores.html" title="# SPONSOR : www.fantaisium.fr#-------------------- Profitons de ce moment où le Main Event des WSOP bat son plein pour faire un petit retour sur les 67 tournois précédents. Et comme le Tour de France déroule lui aussi son ruban sur les routes de l’Hexagone,...">
       <time class="post-date" data-hover="12/07/2015" datetime="2015-07-12T22:36:34+02:00">
        12 juil.
       </time>
       <div class="post-cover">
        <img alt="2015 : des WSOP surréalistes pour les tricolores" height="100" src="http://img.over-blog-kiwi.com/100x100-ct/1/52/82/13/20150712/ob_6b2fa9_leibgorin.jpg" width="100"/>
       </div>
      </a>
      <div class="post-content">
       <header class="header">
        <h2 class="post-title">
         <a href="http://www.over-pair.com/2015/07/2015-des-wsop-surrealistes-pour-les-tricolores.html" title="# SPONSOR : www.fantaisium.fr#-------------------- Profitons de ce moment où le Main Event des WSOP bat son plein pour faire un petit retour sur les 67 tournois précédents. Et comme le Tour de France déroule lui aussi son ruban sur les routes de l’Hexagone,...">
          2015 : des WSOP surréalistes pour les tricolores
         </a>
        </h2>
       </header>
       <div class="body clearfix">
        <p class="snippet">
         # SPONSOR : www.fantaisium.fr#-------------------- Profitons de ce moment où le Main Event des WSOP bat son plein pour faire un petit retour sur les 67 tournois précédents. Et comme le Tour de France déroule lui aussi son ruban sur les routes de l’Hexagone,...
        </p>
       </div>
       <p class="readmore">
        <a href="http://www.over-pair.com/2015/07/2015-des-wsop-surrealistes-pour-les-tricolores.html">
         Lire la suite
        </a>
       </p>
      </div>
     </article>
     <div class="ob-pagination">
      <span class="ob-page ob-page-current ">
       1
      </span>
      <a class="ob-page ob-page-link " href="/page/2">
       2
      </a>
      <a class="ob-page ob-page-link " href="/page/3">
       3
      </a>
      <a class="ob-page ob-page-link " href="/page/4">
       4
      </a>
      <a class="ob-page ob-page-link " href="/page/5">
       5
      </a>
      <a class="ob-page ob-page-link " href="/page/6">
       6
      </a>
      <a class="ob-page ob-page-link " href="/page/7">
       7
      </a>
      <a class="ob-page ob-page-link " href="/page/8">
       8
      </a>
      <a class="ob-page ob-page-link " href="/page/9">
       9
      </a>
      <a class="ob-page ob-page-link ob-page-tens" href="/page/10">
       10
      </a>
      <a class="ob-page ob-page-link ob-page-more ob-page-tens" href="/page/20">
       20
      </a>
      <a class="ob-page ob-page-link ob-page-more ob-page-tens" href="/page/30">
       30
      </a>
      <a class="ob-page ob-page-link ob-page-next" href="/page/2">
       &gt;
      </a>
      <a class="ob-page ob-page-link ob-page-last" href="/page/30">
       &gt;&gt;
      </a>
     </div>
    </section>
    <section class="right-content" role="complementary">
     <aside class="sidebar">
      <div class="widget about clearfix">
       <p class="widget-title">
        À propos
       </p>
       <a class="avatar" href="http://fdata.over-blog.com/0/23/09/04/avatar-blog-15169151-tmpphpmrRGYT.jpeg" title="Over-Pair.com">
        <img height="100" src="http://resize.over-blog.com/100x100-ct.jpg?http://fdata.over-blog.com/0/23/09/04/avatar-blog-15169151-tmpphpmrRGYT.jpeg" width="100"/>
       </a>
       <p>
        François Montmirel blog poker depuis 2006
       </p>
       <p>
        <br/>
        Voir le profil de
        <a href="http://www.over-blog.com/user/1426548.html" target="_blank">
         Francois M.
        </a>
        sur le portail Overblog
       </p>
      </div>
      <div class="widget follow">
       <p class="widget-title">
        Suivez-moi
       </p>
       <ul>
        <li class="facebook">
         <a href="//facebook.com/francois.montmirel" target="_blank">
          Facebook
         </a>
        </li>
        <li class="rss">
         <a href="/rss">
          RSS
         </a>
        </li>
       </ul>
      </div>
      <div class="widget pages">
       <p class="widget-title">
        P… comme Poker
       </p>
       <ul>
        <li>
         <a href="http://www.over-pair.com/pages/Francois_Montmirel-4372830.html">
          ★ Auteur : François Montmirel
         </a>
        </li>
        <li>
         <a href="http://www.over-pair.com/calculez-vos-probabilites.html">
          Calculez vos probabilités
         </a>
        </li>
        <li>
         <a href="http://www.over-pair.com/article-1715185.html">
          C'est quoi ce nom ?!
         </a>
        </li>
        <li>
         <a href="http://www.over-pair.com/article-classification-periodique-des-elements-du-hold-em-42493252.html">
          Classification périodique des éléments du Hold'em
         </a>
        </li>
        <li>
         <a href="http://www.over-pair.com/article-7268530.html">
          Combien de temps durera votre tournoi ?
         </a>
        </li>
        <li>
         <a href="http://www.over-pair.com/article-6449795.html">
          Cotes hors jeu au poker
         </a>
        </li>
        <li>
         <a href="http://www.over-pair.com/2016/11/du-cote-de-la-magie-des-cartes.html">
          Du côté de la magie des cartes
         </a>
        </li>
        <li>
         <a href="http://www.over-pair.com/2017/03/lexique-poker.html">
          Lexique du poker
         </a>
        </li>
        <li>
         <a href="http://www.over-pair.com/2017/02/mes-cours-ateliers-et-formations-consacres-au-poker.html">
          Mes cours, ateliers et formations consacrés au poker
         </a>
        </li>
        <li>
         <a href="http://www.over-pair.com/2015/11/monter-sa-partie-privee-de-poker.html">
          Monter sa partie privée de poker
         </a>
        </li>
        <li>
         <a href="http://www.over-pair.com/article-33232328.html">
          Notation simple des coups de poker
         </a>
        </li>
        <li>
         <a href="http://www.over-pair.com/pages/Quel_livre_de_poker_choisir_-4987074.html">
          Quel livre de poker choisir ?
         </a>
        </li>
        <li>
         <a href="http://www.over-pair.com/2016/11/tour-de-magie-simple-mais-bluffant.html">
          Tour de magie simple mais bluffant
         </a>
        </li>
        <li>
         <a href="http://www.over-pair.com/article-3703876.html">
          Une superbe horloge de tournoi gratuite
         </a>
        </li>
        <li>
         <a href="http://www.over-pair.com/pages/Un_filon_pour_gagner_plus_au_poker-8796676.html">
          Un filon pour gagner plus au poker
         </a>
        </li>
        <li>
         <a href="http://www.over-pair.com/article-2990482.html">
          Verbatim poker : ce qu'ils en pensent
         </a>
        </li>
       </ul>
      </div>
      <div class="widget tags">
       <p class="widget-title">
        Catégories
       </p>
       <ul>
        <li>
         <a href="/tag/annonces-resultats%20de%20tournois/">
          Annonces-Résultats De Tournois (169)
         </a>
        </li>
        <li>
         <a href="/tag/livres/">
          Livres (104)
         </a>
        </li>
        <li>
         <a href="/tag/medias/">
          Médias (99)
         </a>
        </li>
        <li>
         <a href="/tag/evolution/">
          Evolution (78)
         </a>
        </li>
        <li>
         <a href="/tag/strategie/">
          Stratégie (68)
         </a>
        </li>
        <li>
         <a href="/tag/humeurs/">
          Humeurs (44)
         </a>
        </li>
        <li>
         <a href="/tag/astuces/">
          Astuces (32)
         </a>
        </li>
        <li>
         <a href="/tag/retombees%20perso/">
          Retombées Perso (31)
         </a>
        </li>
        <li>
         <a href="/tag/ecole%20francaise%20de%20poker/">
          Ecole Française De Poker (29)
         </a>
        </li>
        <li>
         <a href="/tag/le%20poker%20et%20la%20loi/">
          Le Poker Et La Loi (28)
         </a>
        </li>
        <li>
         <a href="/tag/poker%20en%20ligne/">
          Poker En Ligne (28)
         </a>
        </li>
        <li>
         <a href="/tag/mes%20tournois/">
          Mes Tournois (23)
         </a>
        </li>
        <li>
         <a href="/tag/divers/">
          Divers (22)
         </a>
        </li>
        <li>
         <a href="/tag/interview%20flash/">
          Interview Flash (19)
         </a>
        </li>
        <li>
         <a href="/tag/mes%20succes/">
          Mes Succès (14)
         </a>
        </li>
        <li>
         <a href="/tag/challengeefp/">
          Challengeefp (11)
         </a>
        </li>
        <li>
         <a href="/tag/citations/">
          Citations (11)
         </a>
        </li>
        <li>
         <a href="/tag/au%20cinema/">
          Au Cinéma (9)
         </a>
        </li>
        <li>
         <a href="/tag/poker%20video/">
          Poker Vidéo (9)
         </a>
        </li>
        <li>
         <a href="/tag/adverbes/">
          Adverbes (8)
         </a>
        </li>
        <li>
         <a href="/tag/poker%20bresil/">
          Poker Brésil (8)
         </a>
        </li>
        <li>
         <a href="/tag/reviews%20de%20cours%20%22live%22/">
          Reviews De Cours "live" (8)
         </a>
        </li>
        <li>
         <a href="/tag/friendly%20satellite/">
          Friendly Satellite (5)
         </a>
        </li>
        <li>
         <a href="/tag/presentation%20du%20poker/">
          Présentation Du Poker (2)
         </a>
        </li>
        <li>
         <a href="/tag/ce%20qu%27ils%20en%20pensent/">
          Ce Qu'ils En Pensent (1)
         </a>
        </li>
       </ul>
      </div>
      <div class="widget freeModule">
       <p class="widget-title">
        Liens privilégiés
       </p>
       <div class="box-content">
        <ul class="list">
         <li>
          <a href="http://www.fantaisium.fr/" target="_blank">
           Editions Fantaisium
          </a>
         </li>
         <li>
          <a href="http://www.julienpoker.com/" target="_blank">
           Julien Poker
          </a>
         </li>
         <li>
          <a href="http://fr.pokerlistings.com/" target="_blank">
           PokerListings
          </a>
         </li>
         <li>
          <a href="http://www.manubluff.com" target="_blank">
           Manubluff
          </a>
         </li>
         <li>
          <a href="http://stefalpokerblog.blogspot.fr/" target="_blank">
           Stefal
          </a>
         </li>
         <li>
          <a href="http://pokerfred.blogspot.fr/" target="_blank">
           Poker Fred
          </a>
         </li>
         <li>
          <a href="http://www.pokerbastards.com/" target="_blank">
           Poker Bastards
          </a>
         </li>
         <li>
          <a href="http://www.acteurvente.com/" target="_blank">
           Acteur Vente
          </a>
         </li>
         <li>
          <a href="https://alfange.academy/?a=joker.95" target="_blank">
           Alfange Academy
          </a>
         </li>
         <li>
          <a href="https://leclubdesclubs.org/" target="_blank">
           Le Club des Clubs
          </a>
         </li>
         <li>
          <a href="http://www.lentille-de-couleur.fr/" target="_blank">
